name,description
Agriculture & Farmers' Empowerment,"Issues related to crop insurance (Kalia Yojana), subsidies, seeds, fertilizers, mandi procurement, and irrigation complaints."
Health & Family Welfare,"Complaints regarding government hospitals, BSKY card benefits, doctor absenteeism, medicine shortage, and sanitation in clinics."
School & Mass Education,"Issues with school infrastructure, mid-day meals, teacher attendance, books, uniforms, and local high school facilities."
Panchayati Raj & Drinking Water,"Drinking water supply, tube well repairs, rural housing (PMRY/Biju Pucca Ghar), village roads, and panchayat-level disputes."
Home Department,"Law and order complaints, police behavior, local safety, delays in registering FIRs, and theft investigations."
Housing & Urban Development,"Municipal garbage clearance, sewage cleaning, urban drinking water, streetlights, and municipality tax issues."
